,request,conversation_id,word1,word2,word1_idf,word2_idf,number_of_characters,number_of_words,avg_word_length,number_of_unique_words,avg_tf,average_idf,average_tf_idf
16,"Use the following pieces of context to answer the question at the end. If you don't know the answer, just say that you don't know, don't try to make up an answer.

Previously, the use of dye-sub printing was limited to industrial or high-end commercial printing. Dye-sub photo printing has been used in medical imaging, graphic arts proofing, security, and broadcast-related applications. Today, it is extremely popular in event photography and photo booths or kiosks that require high-speed, on-demand printing.

Alps Electric produced the first quality dye-sub printers for home consumers in the $500–$1,000 price range, bringing dye-sublimation technology within the reach of a wider audience. (These models were, however, not true page printers, since they used a narrow printhead that swept across the page, like most inkjet printers.) Now there are many dye-sublimation printers on the market starting from as low as $100, especially postcard-sized mobile photo printers.

The ability to produce instant photo prints inexpensively from a small printer has led to dye sublimation solutions supplanting traditional instant photos in some applications, such as ID photography with a card printer.

Several corporations market desktop-size units as stand-alone printers and for print kiosk and photo booth applications. Some of these units are based on generic printers. Some manufacturers, offer software development kits with their printers, suggesting that these companies hope to attract system integrators as a potential market.

Desktop-size standalone dye-sub photo printers are also used by photographers in event photography. The technology allows photographers to produce and sell lab-quality prints immediately during the event they are attending, with a minimal amount of hardware. 

Question: What are the uses of a dye sublimation printer?",92,been,by,5.626821433520073,3.892220378131966,1867,275,6.789090909090909,184,0.005434782608695652,5.112549813106629,0.026864048116490857
252,Summarize how your country has been affected by the COVID-19 pandemic.,11348,been,by,5.626821433520073,3.892220378131966,70,11,6.363636363636363,11,0.09090909090909091,4.689062609723181,0.4262784190657437
27,"You are a smart assistant designed to help high school teachers come up with reading comprehension questions.
Given a piece of text, you must come up with a question and answer pair that can be used to test a student's reading comprehension abilities.
When coming up with this question/answer pair, you must respond in the following format:
```
{{
    ""question"": ""$YOUR_QUESTION_HERE"",
    ""answer"": ""$THE_ANSWER_HERE""
}}
```
Everything between the ``` must be valid json.
Please come up with a question/answer pair, in the specified JSON format, for the following text:
----------------
Previously, the use of dye-sub printing was limited to industrial or high-end commercial printing. Dye-sub photo printing has been used in medical imaging, graphic arts proofing, security, and broadcast-related applications. Today, it is extremely popular in event photography and photo booths or kiosks that require high-speed, on-demand printing.

Alps Electric produced the first quality dye-sub printers for home consumers in the $500–$1,000 price range, bringing dye-sublimation technology within the reach of a wider audience. (These models were, however, not true page printers, since they used a narrow printhead that swept across the page, like most inkjet printers.) Now there are many dye-sublimation printers on the market starting from as low as $100, especially postcard-sized mobile photo printers.

The ability to produce instant photo prints inexpensively from a small printer has led to dye sublimation solutions supplanting traditional instant photos in some applications, such as ID photography with a card printer.

Several corporations market desktop-size units as stand-alone printers and for print kiosk and photo booth applications. Some of these units are based on generic printers. Some manufacturers, offer software development kits with their printers, suggesting that these companies hope to attract system integrators as a potential market.

Desktop-size standalone dye-sub photo printers are also used by photographers in event photography. The technology allows photographers to produce and sell lab-quality prints immediately during the event they are attending, with a minimal amount of hardware.",134,been,by,5.626821433520073,3.892220378131966,2240,323,6.934984520123839,210,0.004761904761904762,5.140861555450791,0.024080468527741393
326,"Edit the following sentence to write it in the active voice:

""A new policy regarding customer service has been implemented by the company.""",14398,been,by,5.626821433520073,3.892220378131966,142,23,6.173913043478261,21,0.04761904761904761,3.1827995893150396,0.1406255829737299
22,"Use the following pieces of context to answer the question at the end. If you don't know the answer, just say that you don't know, don't try to make up an answer.

Previously, the use of dye-sub printing was limited to industrial or high-end commercial printing. Dye-sub photo printing has been used in medical imaging, graphic arts proofing, security, and broadcast-related applications. Today, it is extremely popular in event photography and photo booths or kiosks that require high-speed, on-demand printing.

Alps Electric produced the first quality dye-sub printers for home consumers in the $500–$1,000 price range, bringing dye-sublimation technology within the reach of a wider audience. (These models were, however, not true page printers, since they used a narrow printhead that swept across the page, like most inkjet printers.) Now there are many dye-sublimation printers on the market starting from as low as $100, especially postcard-sized mobile photo printers.

The ability to produce instant photo prints inexpensively from a small printer has led to dye sublimation solutions supplanting traditional instant photos in some applications, such as ID photography with a card printer.

Several corporations market desktop-size units as stand-alone printers and for print kiosk and photo booth applications. Some of these units are based on generic printers. Some manufacturers, offer software development kits with their printers, suggesting that these companies hope to attract system integrators as a potential market.

Desktop-size standalone dye-sub photo printers are also used by photographers in event photography. The technology allows photographers to produce and sell lab-quality prints immediately during the event they are attending, with a minimal amount of hardware. 

Question: Is the Epson F7100 a dye sub printer?",100,been,by,5.626821433520073,3.892220378131966,1857,274,6.7773722627737225,186,0.005376344086021506,5.112549813106629,0.02679843259008444
47,"You are a smart assistant designed to help high school teachers come up with reading comprehension questions.
Given a piece of text, you must come up with a question and answer pair that can be used to test a student's reading comprehension abilities.
When coming up with this question/answer pair, you must respond in the following format:
```
{{
    ""question"": ""$YOUR_QUESTION_HERE"",
    ""answer"": ""$THE_ANSWER_HERE""
}}
```
Everything between the ``` must be valid json.
""""""
templ2 = """"""Please come up with three question/answer pairs, in the specified JSON format, for the following text:
----------------
US officials have hinted that this counteroffensive is coming in the next month or so, while Ukrainian forces on the ground have said they are ready to attack when Kyiv gives the word.

According to military analysts who have looked at the documents, certain parts appear to be modified from their original format and exaggerate the American tally of Ukrainians killed in the war while downplaying the estimates of Russian troops killed.

One of the slides states that Russia has lost 16,000 to 17,500 soldiers since the invasion, while Ukraine had suffered as many as 71,500 troop deaths. This is a gross underestimate from what the Pentagon and other analysts have estimated for Russian casualties with nearly 200,000 killed and injured. Ukraine has had more than 100,000 casualties in the war, according to the Pentagon.

The documents appear to represent a significant breach of American intelligence, detailing information that has not been publicly stated by the Pentagon.",727,been,by,5.626821433520073,3.892220378131966,1607,250,6.428,165,0.006060606060606062,4.86880450291133,0.028310807892372197
588,Generate a sentence which reflects the emotions of a dog who has been mistreated by its owners.,28195,been,by,5.626821433520073,3.892220378131966,95,17,5.588235294117647,16,0.06249999999999999,3.8543892563030964,0.2298309332443614
928,"Generate a story about a robot that starts with the sentence ""Robots have always been fascinated by power.""",47650,been,by,5.626821433520073,3.892220378131966,107,18,5.944444444444445,17,0.058823529411764705,3.873271576876928,0.21811156587377648
427,How has the global economy been impacted by the Covid-19 pandemic?,19322,been,by,5.626821433520073,3.892220378131966,66,11,6.0,10,0.1,5.157619082970308,0.47456933172699384
833,"Rewrite the following sentence by replacing the underlined word with a substitute word: 

Recently he has been donating large sums of money to the charity.",41400,been,by,5.626821433520073,3.892220378131966,157,25,6.28,23,0.04347826086956523,3.49139363517038,0.141848270217747
800,What form of art has been most widely adopted by modern society?,38651,been,by,5.626821433520073,3.892220378131966,64,12,5.333333333333333,12,0.08333333333333333,4.858105598538282,0.40484213321152346
184,Name ten jobs that have been replaced by robots.,7490,been,by,5.626821433520073,3.892220378131966,48,9,5.333333333333333,9,0.1111111111111111,5.07365890787077,0.5637398786523077
200,"Summarize the following article in less than 50 words:

""The new composting program launched by the city has been proven to be successful. Surveys report that interest in composting has increased, leading to increased compost collection from residents. The collected compost is then used by the city in their parks and gardens.""",8516,been,by,5.626821433520073,3.892220378131966,330,52,6.346153846153846,42,0.023809523809523808,4.174746945061367,0.093445214831682
561,Provide an example of a natural resource that has been depleted from overuse by humans.,26713,been,by,5.626821433520073,3.892220378131966,87,15,5.8,15,0.06666666666666667,3.7659350306564705,0.25106233537709804
840,What is the primary benefit of using AI in healthcare?,41755,benefit,primary,6.437751649736401,5.572754212249797,54,10,5.4,10,0.1,2.988533548433456,0.29885335484334563
877,Identify the primary benefit of the product,44424,benefit,primary,6.437751649736401,5.572754212249797,43,7,6.142857142857143,6,0.16666666666666663,3.569023488176422,0.5223892115162421
513,What is the primary benefit of eating healthy food?,24250,benefit,primary,6.437751649736401,5.572754212249797,51,9,5.666666666666667,9,0.1111111111111111,3.959520188316121,0.43994668759068
631,Identify the primary benefit of using a web application,30725,benefit,primary,6.437751649736401,5.572754212249797,55,9,6.111111111111111,9,0.1111111111111111,3.596844694586021,0.3996494105095579
509,Explain the primary benefit of the given technology.,23805,benefit,primary,6.437751649736401,5.572754212249797,52,8,6.5,7,0.14285714285714285,2.976427590759985,0.3830160728996573
568,Describe the primary benefit of using a social media marketing strategy.,27012,benefit,primary,6.437751649736401,5.572754212249797,72,11,6.545454545454546,11,0.09090909090909091,3.7386664795197624,0.3398787708654329
504,What is the primary benefit of a membership loyalty program?,23209,benefit,primary,6.437751649736401,5.572754212249797,60,10,6.0,10,0.1,3.4684961709332387,0.3468496170933239
160,Answer the following question: What is the primary benefit of using machine learning?,6366,benefit,primary,6.437751649736401,5.572754212249797,85,13,6.538461538461538,12,0.08333333333333331,3.3502439834632076,0.26192746951819257
164,What is the primary benefit of using a virtual assistant to manage a business?,6601,benefit,primary,6.437751649736401,5.572754212249797,78,14,5.571428571428571,13,0.0769230769230769,3.577379071618134,0.2599788682004098
211,What is the primary benefit of using a relational database?,9088,benefit,primary,6.437751649736401,5.572754212249797,59,10,5.9,10,0.1,3.4683512975874216,0.3468351297587422
87,Describe the primary benefit of an AI-powered marketing platform.,2401,benefit,primary,6.437751649736401,5.572754212249797,65,9,7.222222222222222,9,0.1111111111111111,3.3477156509579182,0.3719684056619909
935,"What is the primary benefit of switching from traditional, on-premise software to cloud software?",47888,benefit,primary,6.437751649736401,5.572754212249797,97,14,6.928571428571429,14,0.07142857142857141,3.5020320156479077,0.25014514397485055
112,What is the primary benefit of creative problem solving?,3738,benefit,primary,6.437751649736401,5.572754212249797,56,9,6.222222222222222,9,0.1111111111111111,3.326630368817298,0.36962559653525523
777,"Write a solution for the following problem in python:

Given the root of a binary tree, return the average value of the nodes on each level in the form of an array. Answers within 10-5 of the actual answer will be accepted.",37678,binary,root,5.626821433520073,6.725433722188183,225,42,5.357142857142857,32,0.03125,4.093144627265801,0.10358856532297572
716,"Write a solution in C++ for the following problem:

Given the root of a binary search tree (BST) with duplicates, return all the mode(s) (i.e., the most frequently occurred element) in it.

If the tree has more than one mode, return them in any order.

Assume a BST is defined as follows:

- The left subtree of a node contains only nodes with keys less than or equal to the node's key.
- The right subtree of a node contains only nodes with keys greater than or equal to the node's key.
- Both the left and right subtrees must also be binary search trees.",35524,binary,root,5.626821433520073,6.725433722188183,566,105,5.390476190476191,66,0.015151515151515152,4.214628783594511,0.06225994492054935
778,"Write a solution for the following problem in python:

Given the root of a binary tree, return the average value of the nodes on each level in the form of an array. Answers within 10-5 of the actual answer will be accepted.",37678,binary,return,5.626821433520073,6.319968614080018,225,42,5.357142857142857,32,0.03125,4.093144627265801,0.10358856532297572
147,"Given two binary strings a and b, return their sum as a binary string. Write the solution as a Haskell function",5268,binary,return,5.626821433520073,6.319968614080018,111,21,5.285714285714286,17,0.058823529411764705,3.9037967107596585,0.22849842655185684
293,"Given the root of a binary tree, return its maximum depth. A binary tree's maximum depth is the number of nodes along the longest path from the root node down to the farthest leaf node.",13299,binary,return,5.626821433520073,6.319968614080018,185,35,5.285714285714286,27,0.037037037037037035,4.775111334766479,0.16751443931109988
292,"Given the root of a binary tree, return its maximum depth. A binary tree's maximum depth is the number of nodes along the longest path from the root node down to the farthest leaf node.",13299,binary,root,5.626821433520073,6.725433722188183,185,35,5.285714285714286,27,0.037037037037037035,4.775111334766479,0.16751443931109988
291,"Given the root of a binary tree, check whether it is a mirror of itself (i.e., symmetric around its center).",13295,binary,root,5.626821433520073,6.725433722188183,108,20,5.4,18,0.05555555555555555,4.083779707534574,0.20990211800225897
772,"Write a solution for the following problem in python:

You are given two binary trees root1 and root2.

Imagine that when you put one of them to cover the other, some nodes of the two trees are overlapped while the others are not. You need to merge the two trees into a new binary tree. The merge rule is that if two nodes overlap, then sum node values up as the new value of the merged node. Otherwise, the NOT null node will be used as the node of the new tree.

Return the merged tree.

Note: The merging process must start from the root nodes of both trees.",37519,binary,root,5.626821433520073,6.725433722188183,569,109,5.220183486238532,70,0.014285714285714282,4.42192767998387,0.05816938895302759
422,"Given the root of a binary tree, return the preorder traversal of its nodes' values. Write the solution in JavaScript",19134,binary,root,5.626821433520073,6.725433722188183,117,20,5.85,17,0.058823529411764705,3.402762422661584,0.17881915357439235
645,"Write a solution for the following problem in c++:

Given the root of a binary tree, construct a string consisting of parenthesis and integers from a binary tree with the preorder traversal way, and return it.

Omit all the empty parenthesis pairs that do not affect the one-to-one mapping relationship between the string and the original binary tree.",31214,binary,return,5.626821433520073,6.319968614080018,355,58,6.120689655172414,42,0.023809523809523815,4.1570868559717065,0.0866916190671352
167,"Given the root of a binary tree, return all root-to-leaf paths in any order.

A leaf is a node with no children.",6757,binary,root,5.626821433520073,6.725433722188183,114,22,5.181818181818182,21,0.04761904761904761,3.9619610886649004,0.1824862589779977
683,"Solve this competitive programming challenge using C++:

Given the root of a binary tree, return the sum of all left leaves.
A leaf is a node with no children. A left leaf is a leaf that is the left child of another node.",32971,binary,root,5.626821433520073,6.725433722188183,224,43,5.209302325581396,30,0.03333333333333334,4.483973530381496,0.1290189969321906
644,"Write a solution for the following problem in c++:

Given the root of a binary tree, construct a string consisting of parenthesis and integers from a binary tree with the preorder traversal way, and return it.

Omit all the empty parenthesis pairs that do not affect the one-to-one mapping relationship between the string and the original binary tree.",31214,binary,root,5.626821433520073,6.725433722188183,355,58,6.120689655172414,42,0.023809523809523815,4.1570868559717065,0.0866916190671352
531,"Given a m x n binary matrix filled with 0's and 1's, find the largest rectangle containing only 1's and return its area. Code it in Python, please.",25344,binary,return,5.626821433520073,6.319968614080018,147,28,5.25,27,0.037037037037037035,4.758527334210978,0.17296890838304513
684,"Solve this competitive programming challenge using C++:

Given the root of a binary tree, return the sum of all left leaves.
A leaf is a node with no children. A left leaf is a leaf that is the left child of another node.",32971,binary,return,5.626821433520073,6.319968614080018,224,43,5.209302325581396,30,0.03333333333333334,4.483973530381496,0.1290189969321906
423,"Given the root of a binary tree, return the preorder traversal of its nodes' values. Write the solution in JavaScript",19134,binary,return,5.626821433520073,6.319968614080018,117,20,5.85,17,0.058823529411764705,3.402762422661584,0.17881915357439235
757,"Given the roots of two binary trees root and subRoot, return true if there is a subtree of root with the same structure and node values of subRoot and false otherwise.

A subtree of a binary tree tree is a tree that consists of a node in tree and all of this node's descendants. The tree tree could also be considered as a subtree of itself.",37172,binary,return,5.626821433520073,6.319968614080018,343,66,5.196969696969697,41,0.024390243902439022,4.435477857152144,0.09986690233484356
717,"Write a solution in C++ for the following problem:

Given the root of a binary search tree (BST) with duplicates, return all the mode(s) (i.e., the most frequently occurred element) in it.

If the tree has more than one mode, return them in any order.

Assume a BST is defined as follows:

- The left subtree of a node contains only nodes with keys less than or equal to the node's key.
- The right subtree of a node contains only nodes with keys greater than or equal to the node's key.
- Both the left and right subtrees must also be binary search trees.",35524,binary,return,5.626821433520073,6.319968614080018,566,105,5.390476190476191,66,0.015151515151515152,4.214628783594511,0.06225994492054935
756,"Given the roots of two binary trees root and subRoot, return true if there is a subtree of root with the same structure and node values of subRoot and false otherwise.

A subtree of a binary tree tree is a tree that consists of a node in tree and all of this node's descendants. The tree tree could also be considered as a subtree of itself.",37172,binary,root,5.626821433520073,6.725433722188183,343,66,5.196969696969697,41,0.024390243902439022,4.435477857152144,0.09986690233484356
788,"Write a solution for the following problem in javascript:

Given the root of a binary search tree and an integer k, return true if there exist two elements in the BST such that their sum is equal to k, or false otherwise.",37827,binary,return,5.626821433520073,6.319968614080018,223,42,5.309523809523809,37,0.02702702702702703,3.9668604195372357,0.09640910756435132
502,"Given an integer n, return an array ans of length n + 1 such that for each i (0 <= i <= n), ans[i] is the number of 1's in the binary representation of i. Write the shortest possible solution in python.",23143,binary,return,5.626821433520073,6.319968614080018,202,42,4.809523809523809,34,0.029411764705882353,3.821670497017105,0.10064052164078267
709,"Write the solution to this in Python:

Given a binary array nums, return the maximum number of consecutive 1's in the array.",35045,binary,return,5.626821433520073,6.319968614080018,126,22,5.7272727272727275,19,0.05263157894736841,3.59317459456261,0.16985202397685828
787,"Write a solution for the following problem in javascript:

Given the root of a binary search tree and an integer k, return true if there exist two elements in the BST such that their sum is equal to k, or false otherwise.",37827,binary,root,5.626821433520073,6.725433722188183,223,42,5.309523809523809,37,0.02702702702702703,3.9668604195372357,0.09640910756435132
446,"Given the root of a binary tree, invert the tree, and return its root.",20653,binary,return,5.626821433520073,6.319968614080018,70,14,5.0,12,0.08333333333333331,3.2526932730773734,0.2362504566679049
445,"Given the root of a binary tree, invert the tree, and return its root.",20653,binary,root,5.626821433520073,6.725433722188183,70,14,5.0,12,0.08333333333333331,3.2526932730773734,0.2362504566679049
734,"Given the root of a binary tree, return the length of the diameter of the tree.

The diameter of a binary tree is the length of the longest path between any two nodes in a tree. This path may or may not pass through the root.

The length of a path between two nodes is represented by the number of edges between them.",36366,binary,root,5.626821433520073,6.725433722188183,321,63,5.095238095238095,33,0.030303030303030304,4.143492040807702,0.1122546058302179
255,"Given the root of a binary tree, return the inorder traversal of its nodes' values.",11396,binary,root,5.626821433520073,6.725433722188183,83,15,5.533333333333333,13,0.07692307692307693,3.4877294678353654,0.24322083001997669
258,"Given the root of a binary tree and an integer targetSum, return true if the tree has a root-to-leaf path such that adding up all the values along the path equals targetSum.

A leaf is a node with no children.",11440,binary,root,5.626821433520073,6.725433722188183,211,40,5.275,33,0.030303030303030304,4.601071934109363,0.1315289756273847
259,"Given the root of a binary tree and an integer targetSum, return true if the tree has a root-to-leaf path such that adding up all the values along the path equals targetSum.

A leaf is a node with no children.",11440,binary,return,5.626821433520073,6.319968614080018,211,40,5.275,33,0.030303030303030304,4.601071934109363,0.1315289756273847
706,"The complement of an integer is the integer you get when you flip all the 0's to 1's and all the 1's to 0's in its binary representation.

For example, The integer 5 is ""101"" in binary and its complement is ""010"" which is the integer 2.
Given an integer num, return its complement.

Give me the C++ solution.",34821,binary,return,5.626821433520073,6.319968614080018,313,59,5.305084745762712,35,0.028571428571428567,3.7007211985987416,0.11909253690222517
749,"Given the root of a binary tree, return the sum of every tree node's tilt.

The tilt of a tree node is the absolute difference between the sum of all left subtree node values and all right subtree node values. If a node does not have a left child, then the sum of the left subtree node values is treated as 0. The rule is similar if the node does not have a right child.",36953,binary,return,5.626821433520073,6.319968614080018,372,75,4.96,40,0.025,4.906668915334922,0.11668982347536588
748,"Given the root of a binary tree, return the sum of every tree node's tilt.

The tilt of a tree node is the absolute difference between the sum of all left subtree node values and all right subtree node values. If a node does not have a left child, then the sum of the left subtree node values is treated as 0. The rule is similar if the node does not have a right child.",36953,binary,root,5.626821433520073,6.725433722188183,372,75,4.96,40,0.025,4.906668915334922,0.11668982347536588
