,request,conversation_id,word1,word2,word1_idf,word2_idf,number_of_characters,number_of_words,avg_word_length,number_of_unique_words,avg_tf,average_idf,average_tf_idf
924,Calculate 6 squared divided by 8,47528,8,6,5.184988681241034,5.572754212249797,32,6,5.333333333333333,6,0.16666666666666666,5.758795579311822,0.9597992632186368
710,"Generate a password which is secure, easy to remember and has a minimum length of 8 characters.",35161,8,password,5.184988681241034,7.1308988302963465,95,17,5.588235294117647,16,0.06249999999999999,4.269620185682303,0.2542562820313736
104,Create a password for email that includes 8 characters.,3198,8,password,5.184988681241034,7.1308988302963465,55,9,6.111111111111111,9,0.1111111111111111,4.340270010570705,0.48225222339674506
819,"Of the 36 students in Richelle's class, 12 prefer chocolate pie, 8 prefer apple, and 6 prefer blueberry. Half of the remaining students prefer cherry pie and half prefer lemon. For Richelle's pie graph showing this data, how many degrees should she use for cherry pie?",40239,8,6,5.184988681241034,5.572754212249797,268,46,5.826086956521739,36,0.027777777777777776,4.092036699201128,0.12464379942692445
616,Calculate the area of a trapezoid with sides of 5 and 6 and height of 8,29863,8,6,5.184988681241034,5.572754212249797,71,16,4.4375,13,0.07692307692307693,3.3894137504077038,0.22876217610445126
829,"The lattice shown is continued for 9 rows. What will be the third number in the 9th row? 
Row 1:     1     2     3     4     5 
Row 2:     6     7     8     9     10 
Row 3:     11     12     13     14     15 
Row 4:     16     17     18     19     20
",41121,8,6,5.184988681241034,5.572754212249797,257,46,5.586956521739131,41,0.024390243902439025,4.604578761328815,0.1065145623371502
825,"Please create a random password which contains 8 letters, 2 numbers and 2 symbols.",40745,8,password,5.184988681241034,7.1308988302963465,82,14,5.857142857142857,13,0.0769230769230769,4.171190453951742,0.32160779317040616
824,"Please create a random password which contains 8 letters, 2 numbers and 2 symbols.",40745,8,random,5.184988681241034,5.683979847360021,82,14,5.857142857142857,13,0.0769230769230769,4.171190453951742,0.32160779317040616
377,"Generate a random password with 8 characters containing at least one number, one special character, one capital letter and one lowercase letter.",17173,8,password,5.184988681241034,7.1308988302963465,144,22,6.545454545454546,19,0.05263157894736842,4.887781820764062,0.2579194074233271
218,Write a code to generate a random password with 8 characters.,9561,8,password,5.184988681241034,7.1308988302963465,61,11,5.545454545454546,10,0.1,4.220813451903929,0.39150094920789846
904,Generate a password containing 8 characters with one number and one special character.,45981,8,password,5.184988681241034,7.1308988302963465,86,13,6.615384615384615,12,0.08333333333333331,4.519194958961125,0.3778782715565918
745,"Generate a random password with 8 characters, consisting of lower and upper-case letters and numbers.",36924,8,random,5.184988681241034,5.683979847360021,101,15,6.733333333333333,14,0.07142857142857142,4.278207608677596,0.2971208028731096
601,Generate a random password with length 8 and complexity 4.,29132,8,random,5.184988681241034,5.683979847360021,58,10,5.8,10,0.1,4.539276895782308,0.4539276895782308
63,Calculate 8 minus 6 in the base two system.,1303,8,6,5.184988681241034,5.572754212249797,43,9,4.777777777777778,9,0.1111111111111111,3.534282950817507,0.39269810564638963
376,"Generate a random password with 8 characters containing at least one number, one special character, one capital letter and one lowercase letter.",17173,8,random,5.184988681241034,5.683979847360021,144,22,6.545454545454546,19,0.05263157894736842,4.887781820764062,0.2579194074233271
123,Generate a computer password with at least 8 characters.,4539,8,password,5.184988681241034,7.1308988302963465,56,9,6.222222222222222,9,0.1111111111111111,4.36285693901746,0.48476188211305116
449,Generate a random password of length 8 that contains at least one number and one special character.,20729,8,random,5.184988681241034,5.683979847360021,99,17,5.823529411764706,16,0.06249999999999999,4.219090602130195,0.26470375690154785
450,Generate a random password of length 8 that contains at least one number and one special character.,20729,8,password,5.184988681241034,7.1308988302963465,99,17,5.823529411764706,16,0.06249999999999999,4.219090602130195,0.26470375690154785
204,"Generate a password that is 8 characters in length and contains at least 1 uppercase letter, 1 lowercase letter, 1 special character and 1 number.",8722,8,password,5.184988681241034,7.1308988302963465,146,25,5.84,20,0.05000000000000001,4.617894124758342,0.2231305079223042
746,"Generate a random password with 8 characters, consisting of lower and upper-case letters and numbers.",36924,8,password,5.184988681241034,7.1308988302963465,101,15,6.733333333333333,14,0.07142857142857142,4.278207608677596,0.2971208028731096
497,Generate a random sentence between 4 to 8 words.,22450,8,random,5.184988681241034,5.683979847360021,48,9,5.333333333333333,9,0.1111111111111111,3.4259944367900395,0.3806660485322266
499,"Generate a random password with length 8 and containing one capital letter, one number, and one special character.",22554,8,password,5.184988681241034,7.1308988302963465,114,18,6.333333333333333,15,0.06666666666666667,4.750631521908211,0.31176180846592466
455,Reshape the following array of size 6 to 8,20982,8,6,5.184988681241034,5.572754212249797,42,9,4.666666666666667,9,0.1111111111111111,3.2972077834963485,0.36635642038848315
792,"Generate a password with more than 8 characters that includes an upper case letter, a lower case letter, a symbol and a number.",37962,8,password,5.184988681241034,7.1308988302963465,127,23,5.521739130434782,18,0.05555555555555555,4.680986253396879,0.22897668193719492
901,Check if this mathematical expression is correct: 4x - 6 = 8,45767,8,6,5.184988681241034,5.572754212249797,60,12,5.0,12,0.08333333333333333,4.544177070217903,0.3786814225181586
98,"Generate a random ""password"" that meets the following criteria: - 8 characters long - Must contain at least 1 letter and 1 number",3052,8,random,5.184988681241034,5.683979847360021,129,23,5.608695652173913,21,0.04761904761904761,4.116837818233142,0.19232521839810404
144,"Generate a password that meets the following criteria: at least 8 characters long and must contain any two of the following: numbers, lowercase letters, uppercase letters and special characters.",5191,8,password,5.184988681241034,7.1308988302963465,194,29,6.689655172413793,27,0.037037037037037035,4.5990452244279325,0.1619472817486771
483,Create a password with 8 characters which includes two numbers.,22090,8,password,5.184988681241034,7.1308988302963465,63,10,6.3,10,0.1,4.11561484725703,0.41156148472570303
602,Generate a random password with length 8 and complexity 4.,29132,8,password,5.184988681241034,7.1308988302963465,58,10,5.8,10,0.1,4.539276895782308,0.4539276895782308
411,"Generate a random password that contains at least 8 characters, with one uppercase, one lowercase, and one number.",18736,8,password,5.184988681241034,7.1308988302963465,114,18,6.333333333333333,16,0.0625,3.947215233300804,0.2590091868272736
715,Calculate 3 * 4 * 5 * 6 * 7 * 8 * 9.,35408,8,6,5.184988681241034,5.572754212249797,36,14,2.5714285714285716,9,0.1111111111111111,4.946672903465792,0.35333377881898514
410,"Generate a random password that contains at least 8 characters, with one uppercase, one lowercase, and one number.",18736,8,random,5.184988681241034,5.683979847360021,114,18,6.333333333333333,16,0.0625,3.947215233300804,0.2590091868272736
915,"Find all solutions to

    sqrt(x + 3 - 4 sqrt(x - 1)) + sqrt(x + 8 - 6 sqrt(x - 1)) = 1.
",46908,8,6,5.184988681241034,5.572754212249797,93,23,4.043478260869565,14,0.07142857142857141,5.20388423813394,0.22625583644060607
688,"Given the username @Cleto55, generate a suitable password that contains 8 characters, at least one uppercase, one lowercase, one number, and one special symbol.",33112,8,password,5.184988681241034,7.1308988302963465,160,24,6.666666666666667,21,0.0476190476190476,4.357459632768205,0.2166699761815234
611,Generate a password of 8 characters consisting of alphanumeric characters and symbols.,29527,8,password,5.184988681241034,7.1308988302963465,86,12,7.166666666666667,10,0.1,3.4611916675214793,0.3739638426928516
974,Calculate the total number of hours if 6 people work for 8 hours each.,51315,8,6,5.184988681241034,5.572754212249797,70,14,5.0,13,0.0769230769230769,4.049714874242718,0.3374379514247923
217,Write a code to generate a random password with 8 characters.,9561,8,random,5.184988681241034,5.683979847360021,61,11,5.545454545454546,10,0.1,4.220813451903929,0.39150094920789846
310,Generate a computer password that is 8 characters long,13797,8,password,5.184988681241034,7.1308988302963465,54,9,6.0,9,0.1111111111111111,4.443999885385971,0.49377776504288556
689,"Generate a password that follows the following criteria:

• Must contain at least 8 characters
• Must include upper and lowercase letters
• Must include a least one number
• Must include at least one special character",33132,8,password,5.184988681241034,7.1308988302963465,222,37,6.0,24,0.041666666666666664,4.80518047483112,0.17624497705762393
526,"Generate a password that is 8 characters long, using at least one letter, one number, and one special character like ~!@#$%^&*",25083,8,password,5.184988681241034,7.1308988302963465,126,21,6.0,19,0.05263157894736842,4.29474213457637,0.23126136499850514
392,Create a complex password with a minimum of 8 characters.,17883,8,password,5.184988681241034,7.1308988302963465,57,10,5.7,9,0.1111111111111111,4.185075158397837,0.42830145748354986
396,"Generate a password with 8 characters, including a symbol and a number.",18228,8,password,5.184988681241034,7.1308988302963465,71,12,5.916666666666667,10,0.1,4.542548639864787,0.3948689560616757
498,"Generate a random password with length 8 and containing one capital letter, one number, and one special character.",22554,8,random,5.184988681241034,5.683979847360021,114,18,6.333333333333333,15,0.06666666666666667,4.750631521908211,0.31176180846592466
215,Summarise the given article in 6 to 8 sentences.,9494,8,6,5.184988681241034,5.572754212249797,48,9,5.333333333333333,9,0.1111111111111111,2.836162679390346,0.3151291865989273
545,Generate a password which is 8 characters long and contains both numbers and letters,25943,8,password,5.184988681241034,7.1308988302963465,84,14,6.0,13,0.0769230769230769,4.57844752415328,0.33660006071196896
24,Generate a password of 8 characters.,102,8,password,5.184988681241034,7.1308988302963465,36,6,6.0,6,0.16666666666666666,3.4217598354161587,0.5702933059026931
517,"Generate a random password with at least 8 characters, containing upper- and lowercase letters.",24404,8,random,5.184988681241034,5.683979847360021,95,14,6.785714285714286,14,0.07142857142857141,4.5735507048783495,0.3266821932055964
518,"Generate a random password with at least 8 characters, containing upper- and lowercase letters.",24404,8,password,5.184988681241034,7.1308988302963465,95,14,6.785714285714286,14,0.07142857142857141,4.5735507048783495,0.3266821932055964
269,Generate a password of 8 characters that contains one uppercase letter and one number.,12233,8,password,5.184988681241034,7.1308988302963465,86,14,6.142857142857143,13,0.0769230769230769,4.182684086163274,0.3242970822113096
322,"Create a password for the account with at least 8 characters, 1 uppercase letter, 1 lowercase letter, and 2 numbers.",14219,8,password,5.184988681241034,7.1308988302963465,116,20,5.8,18,0.05555555555555555,4.295609851979345,0.23230290430886733
92,Identify if the given sentence is using the active or passive voice.,2711,active,passive,5.472670753692815,5.0206856299497575,68,12,5.666666666666667,11,0.09090909090909091,3.179848446397267,0.26904760166446073
774,Rewrite the following sentence so that it uses an active voice instead of a passive one.,37547,active,passive,5.472670753692815,5.0206856299497575,88,16,5.5,16,0.0625,3.6070776730270215,0.22544235456418885
471,Detect if the following sentence is written in passive or active voice.,21577,active,passive,5.472670753692815,5.0206856299497575,71,12,5.916666666666667,12,0.08333333333333333,3.0779255239124317,0.2564937936593693
937,"Change the syntax of the sentence to active voice :""The delicious dinner was made by him"".",48233,active,by,5.472670753692815,3.892220378131966,90,16,5.625,15,0.06666666666666667,4.522339065943721,0.28493007163286993
468,Identify whether this sentence is written in active or passive voice.,21531,active,passive,5.472670753692815,5.0206856299497575,69,11,6.2727272727272725,11,0.09090909090909091,3.6830794477102407,0.3348254043372947
908,Explain the differences between active and passive transport.,46551,active,passive,5.472670753692815,5.0206856299497575,61,8,7.625,8,0.125,3.4594723996342354,0.4324340499542794
91,Change the following sentence to the active voice: The presentation was given by our manager.,2517,active,by,5.472670753692815,3.892220378131966,93,15,6.2,14,0.07142857142857142,3.4520247761726077,0.23305835149274956
946,"Rewrite the following sentence with active voice:
""The form was filled out by me.""",49113,active,by,5.472670753692815,3.892220378131966,83,14,5.928571428571429,14,0.07142857142857141,3.848928089092084,0.27492343493514887
740,"Change the following sentence from passive to active voice:
The new product was launched yesterday",36582,active,passive,5.472670753692815,5.0206856299497575,99,15,6.6,15,0.06666666666666667,4.191514834726806,0.2794343223151204
802,"Re-word the following sentence to use active voice:

""The door was shut by Sarah.""",38798,active,by,5.472670753692815,3.892220378131966,84,14,6.0,14,0.07142857142857141,2.7462253601152553,0.19615895429394678
469,Convert this sentence written in passive voice to an active voice sentence.,21532,active,passive,5.472670753692815,5.0206856299497575,75,12,6.25,11,0.09090909090909091,3.5172067914832086,0.34821393478984786
857,"Given the following sentence, determine whether it is active or passive voice",42992,active,passive,5.472670753692815,5.0206856299497575,77,12,6.416666666666667,12,0.08333333333333333,3.7832212335412017,0.31526843612843347
118,"Rewrite the following paragraph, replacing the passive voice with active voice where appropriate.",4122,active,passive,5.472670753692815,5.0206856299497575,97,13,7.461538461538462,11,0.09090909090909091,3.3713178708362577,0.32078165156568395
884,Rewrite the following sentence using active voice instead of passive voice: The game was watched by hundreds of viewers.,44813,active,by,5.472670753692815,3.892220378131966,120,19,6.315789473684211,18,0.055555555555555546,4.0437242851694,0.21583450586445796
413,Change this sentence from active to passive voice - Jack bought a new car.,18800,active,passive,5.472670753692815,5.0206856299497575,74,14,5.285714285714286,14,0.07142857142857141,3.763119646043587,0.2687942604316848
414,"Convert this sentence from passive to active -
The door was opened by her",18808,active,by,5.472670753692815,3.892220378131966,74,14,5.285714285714286,14,0.07142857142857141,2.8702405187360704,0.20501717990971927
885,Rewrite the following sentence using active voice instead of passive voice: The game was watched by hundreds of viewers.,44813,active,passive,5.472670753692815,5.0206856299497575,120,19,6.315789473684211,18,0.055555555555555546,4.0437242851694,0.21583450586445796
415,"Convert this sentence from passive to active -
The door was opened by her",18808,active,passive,5.472670753692815,5.0206856299497575,74,14,5.285714285714286,14,0.07142857142857141,2.8702405187360704,0.20501717990971927
961,"Rewrite this sentence in the active voice: ""The test was taken by Emily yesterday"".",50182,active,by,5.472670753692815,3.892220378131966,83,14,5.928571428571429,14,0.07142857142857141,3.6299452000459076,0.25928180000327905
649,"Change the following sentence from active to passive voice: ""I changed the plan""",31272,active,passive,5.472670753692815,5.0206856299497575,80,13,6.153846153846154,12,0.08333333333333331,3.3843289949900726,0.26454939348179757
394,Categorize this sentence as passive or active voice,18071,active,passive,5.472670753692815,5.0206856299497575,51,8,6.375,8,0.125,4.029951957715572,0.5037439947144465
182,Classify the given sentence as active or passive voice.,7469,active,passive,5.472670753692815,5.0206856299497575,55,9,6.111111111111111,9,0.1111111111111111,3.1407722929957096,0.34897469922174545
187,"Change the following sentence from the passive voice to the active voice:
The painting was created by the artist.",7740,active,by,5.472670753692815,3.892220378131966,114,19,6.0,16,0.0625,3.9648005257351175,0.21444351401482672
555,"Change the following sentence to active voice:
""The tent was pitched by the students.",26406,active,by,5.472670753692815,3.892220378131966,86,14,6.142857142857143,13,0.0769230769230769,2.8813038518818828,0.21028195842203615
558,"Convert the following sentence from the active to the passive voice.
""John ran the marathon""",26604,active,passive,5.472670753692815,5.0206856299497575,93,15,6.2,12,0.08333333333333333,2.4929666412030294,0.17716040013486106
429,"Rewrite this sentence in an active voice:

The party was attended by everyone",19767,active,by,5.472670753692815,3.892220378131966,79,13,6.076923076923077,13,0.0769230769230769,4.10268231079565,0.3155909469842808
433,"Classify the following sentence as an example of active or passive voice: 

""The sun rose slowly in the east""",20366,active,passive,5.472670753692815,5.0206856299497575,111,19,5.842105263157895,18,0.055555555555555546,3.406021225269307,0.1810395987477221
725,Convert this sentence from it's active form to it's passive form,36011,active,passive,5.472670753692815,5.0206856299497575,64,11,5.818181818181818,9,0.1111111111111111,3.60376360092195,0.3936305349790226
379,"Rewrite the following sentence in the active voice:

The possibility of winning was thought to be impossible by many.",17188,active,by,5.472670753692815,3.892220378131966,119,19,6.2631578947368425,18,0.055555555555555546,2.9203531241160103,0.1558009058730262
827,"Rewrite the following sentence to use an active voice:

The school was visited by the mayor yesterday.",40841,active,by,5.472670753692815,3.892220378131966,104,17,6.117647058823529,16,0.06249999999999999,3.650461421437743,0.21707797111230767
133,Edit the following sentence to use the active voice instead of passive voice.,4843,active,passive,5.472670753692815,5.0206856299497575,77,13,5.923076923076923,12,0.08333333333333331,3.563931366302353,0.2775216817323838
202,Transform this sentence from the passive voice to the active voice.,8551,active,passive,5.472670753692815,5.0206856299497575,67,11,6.090909090909091,10,0.1,3.3167360019579526,0.3065044656573862
127,"Transform the following passive voice sentence into active voice, and maintain the meaning of the sentence.",4623,active,passive,5.472670753692815,5.0206856299497575,107,16,6.6875,14,0.07142857142857142,3.38174608899661,0.21634214149622408
126,"Rewrite the following in an active voice:

The car was driven by the woman",4608,active,by,5.472670753692815,3.892220378131966,76,14,5.428571428571429,13,0.0769230769230769,3.8771136394864163,0.2800688668360752
632,Rewrite this sentence using active voice: The instructions were given by me,30805,active,by,5.472670753692815,3.892220378131966,75,12,6.25,12,0.08333333333333333,4.267257440359214,0.3556047866966011
189,"Change the following sentence from the passive voice to the active voice:
The painting was created by the artist.",7740,active,passive,5.472670753692815,5.0206856299497575,114,19,6.0,16,0.0625,3.9648005257351175,0.21444351401482672
369,"Convert the following sentence from active to passive voice.
The police arrested the suspect.",16737,active,passive,5.472670753692815,5.0206856299497575,94,14,6.714285714285714,13,0.0769230769230769,2.8491047328034615,0.2079820213450061
83,"Rewrite the following sentence in active voice: 
The ball was thrown by Jack.",2198,active,by,5.472670753692815,3.892220378131966,78,13,6.0,13,0.0769230769230769,3.5085349310640983,0.269887302389546
85,Transform this sentence from active to passive voice:,2318,active,passive,5.472670753692815,5.0206856299497575,53,8,6.625,8,0.125,3.357189869920426,0.41964873374005324
923,"Given two sentences, determine which one is written in active voice and which one is written in passive voice.",47521,active,passive,5.472670753692815,5.0206856299497575,110,19,5.7894736842105265,14,0.07142857142857141,3.8761298519990244,0.2834603820378226
52,Change the sentence from passive to active voice.,752,active,passive,5.472670753692815,5.0206856299497575,49,8,6.125,8,0.125,3.020595697645747,0.3775744622057184
239,"Change this sentence to the active voice: ""The ball was caught by the boy.""",10477,active,by,5.472670753692815,3.892220378131966,75,14,5.357142857142857,13,0.0769230769230769,3.6655289008342633,0.26573871579339703
344,"Rewrite the following sentence using the active voice:

The assignment was finished by the student.",15561,active,by,5.472670753692815,3.892220378131966,101,15,6.733333333333333,13,0.07692307692307693,3.991563973763073,0.2734126809539775
343,"Transfer the following sentence from the active to the passive voice: ""I am writing a book.""",15481,active,passive,5.472670753692815,5.0206856299497575,92,16,5.75,14,0.07142857142857142,3.265306013342408,0.20956293786123004
567,"Change this sentence from passive to active voice:

The new policy was announced by the mayor.",27003,active,passive,5.472670753692815,5.0206856299497575,96,16,6.0,16,0.0625,3.509532116392924,0.21934575727455774
44,Change the sentences from active voice to passive voice.,685,active,passive,5.472670753692815,5.0206856299497575,56,9,6.222222222222222,9,0.1111111111111111,3.7816824548000976,0.42018693942223306
574,"Rewrite the following text in an active voice: ""The apples were picked by me"".",27305,active,by,5.472670753692815,3.892220378131966,78,14,5.571428571428571,14,0.07142857142857141,3.4884489560061973,0.24917492542901407
547,Rewrite the sentence in active voice: The study was written by Dr. Susan Smith.,26109,active,by,5.472670753692815,3.892220378131966,79,14,5.642857142857143,14,0.07142857142857141,3.887719006256203,0.2776942147325859
336,"Convert the sentence from passive to active voice: ""The student was given a laptop by his parents.""",15121,active,passive,5.472670753692815,5.0206856299497575,99,17,5.823529411764706,17,0.058823529411764705,3.553811070027941,0.20904771000164357
511,"Convert the following sentence into active voice:

The beach was walked by me.",24137,active,by,5.472670753692815,3.892220378131966,80,13,6.153846153846154,13,0.0769230769230769,3.1403389357608607,0.24156453352006618
335,"Convert the sentence from passive to active voice: ""The student was given a laptop by his parents.""",15121,active,by,5.472670753692815,3.892220378131966,99,17,5.823529411764706,17,0.058823529411764705,3.553811070027941,0.20904771000164357
696,Edit this sentence to make it active “The flowers were watered by her.”,33791,active,by,5.472670753692815,3.892220378131966,71,13,5.461538461538462,13,0.0769230769230769,4.11885405362822,0.3168349272021708
850,Identify if the following phrase is passive or active voice. Output “Passive” or “Active”.,42451,active,passive,5.472670753692815,5.0206856299497575,90,14,6.428571428571429,13,0.0769230769230769,3.1079203927347576,0.25143036168049976
327,"Edit the following sentence to write it in the active voice:

""A new policy regarding customer service has been implemented by the company.""",14398,active,by,5.472670753692815,3.892220378131966,142,23,6.173913043478261,21,0.04761904761904761,3.1827995893150396,0.1406255829737299
323,Change the verb in the sentence from the passive to an active form,14228,active,passive,5.472670753692815,5.0206856299497575,66,13,5.076923076923077,11,0.09090909090909091,3.031366076419183,0.23992823606588126
853,The given text is written in passive voice. Rewrite the sentence in active voice.,42684,active,passive,5.472670753692815,5.0206856299497575,81,14,5.785714285714286,12,0.08333333333333331,3.1148849391859317,0.23034415600292205
569,Determine if the following sentence is active or passive voice – “The decision was made by them”.,27033,active,by,5.472670753692815,3.892220378131966,97,17,5.705882352941177,17,0.058823529411764705,3.914130670443837,0.23024298061434337
570,Determine if the following sentence is active or passive voice – “The decision was made by them”.,27033,active,passive,5.472670753692815,5.0206856299497575,97,17,5.705882352941177,17,0.058823529411764705,3.914130670443837,0.23024298061434337
859,Determine whether the provided sentence is in the passive or active voice.,43113,active,passive,5.472670753692815,5.0206856299497575,74,12,6.166666666666667,11,0.09090909090909091,3.2887505323315036,0.2781227754923138
300,"Rewrite this sentence ""The mouse was eaten by the cat."" in active voice.",13538,active,by,5.472670753692815,3.892220378131966,72,13,5.538461538461538,13,0.0769230769230769,3.8598307824695226,0.29691006018996335
922,Identify the passive and active voice used in the following sentence.,47369,active,passive,5.472670753692815,5.0206856299497575,69,11,6.2727272727272725,10,0.1,3.0688047836690653,0.2839652639947601
566,"Change this sentence from passive to active voice:

The new policy was announced by the mayor.",27003,active,by,5.472670753692815,3.892220378131966,96,16,6.0,16,0.0625,3.509532116392924,0.21934575727455774
503,Convert the given sentence written in the active voice to passive voice.,23197,active,passive,5.472670753692815,5.0206856299497575,72,12,6.0,11,0.09090909090909091,3.27242508530033,0.2767623215730494
