,request,conversation_id,word1,word2,word1_idf,word2_idf,number_of_characters,number_of_words,avg_word_length,number_of_unique_words,avg_tf,average_idf,average_tf_idf
461,"Given two strings s and t, return true if t is an anagram of s, and false otherwise.

An Anagram is a word or phrase formed by rearranging the letters of a different word or phrase, typically using all the original letters exactly once.",21264,return,by,6.319968614080018,3.892220378131966,238,44,5.409090909090909,36,0.027777777777777776,4.709611000757051,0.12453254212464139
457,Write a SQL query to return the latest order placed by each customer.,21039,return,by,6.319968614080018,3.892220378131966,69,13,5.3076923076923075,13,0.0769230769230769,4.258596067033793,0.3275843128487532
321,"Given a sentence and a search query, return a sentence that accurately conveys the meaning of the search query by replacing one or more words in the sentence.",14206,return,by,6.319968614080018,3.892220378131966,158,28,5.642857142857143,22,0.04545454545454544,3.250507425728948,0.1342009118027044
212,What is the square root of 121?,9264,root,square,6.725433722188183,6.437751649736401,31,7,4.428571428571429,7,0.14285714285714282,3.2458767199982383,0.4636966742854627
659,Approximate the square root of 1000.,31795,root,square,6.725433722188183,6.437751649736401,36,6,6.0,6,0.16666666666666666,3.5718165622936437,0.5953027603822739
736,"Given the root of a binary tree, return the length of the diameter of the tree.

The diameter of a binary tree is the length of the longest path between any two nodes in a tree. This path may or may not pass through the root.

The length of a path between two nodes is represented by the number of edges between them.",36366,root,return,6.725433722188183,6.319968614080018,321,63,5.095238095238095,33,0.030303030303030304,4.143492040807702,0.1122546058302179
646,"Write a solution for the following problem in c++:

Given the root of a binary tree, construct a string consisting of parenthesis and integers from a binary tree with the preorder traversal way, and return it.

Omit all the empty parenthesis pairs that do not affect the one-to-one mapping relationship between the string and the original binary tree.",31214,root,return,6.725433722188183,6.319968614080018,355,58,6.120689655172414,42,0.023809523809523815,4.1570868559717065,0.0866916190671352
424,"Given the root of a binary tree, return the preorder traversal of its nodes' values. Write the solution in JavaScript",19134,root,return,6.725433722188183,6.319968614080018,117,20,5.85,17,0.058823529411764705,3.402762422661584,0.17881915357439235
447,"Given the root of a binary tree, invert the tree, and return its root.",20653,root,return,6.725433722188183,6.319968614080018,70,14,5.0,12,0.08333333333333331,3.2526932730773734,0.2362504566679049
59,Find the square root of 156.,1002,root,square,6.725433722188183,6.437751649736401,28,6,4.666666666666667,6,0.16666666666666666,3.5718165622936437,0.5953027603822739
750,"Given the root of a binary tree, return the sum of every tree node's tilt.

The tilt of a tree node is the absolute difference between the sum of all left subtree node values and all right subtree node values. If a node does not have a left child, then the sum of the left subtree node values is treated as 0. The rule is similar if the node does not have a right child.",36953,root,return,6.725433722188183,6.319968614080018,372,75,4.96,40,0.025,4.906668915334922,0.11668982347536588
475,Determine the square root of 36.,21852,root,square,6.725433722188183,6.437751649736401,32,6,5.333333333333333,6,0.16666666666666666,3.5718165622936437,0.5953027603822739
789,"Write a solution for the following problem in javascript:

Given the root of a binary search tree and an integer k, return true if there exist two elements in the BST such that their sum is equal to k, or false otherwise.",37827,root,return,6.725433722188183,6.319968614080018,223,42,5.309523809523809,37,0.02702702702702703,3.9668604195372357,0.09640910756435132
29,Write a javascript function which calculates the square root of a number without any libraries.,147,root,square,6.725433722188183,6.437751649736401,95,15,6.333333333333333,14,0.07142857142857142,3.202878637295299,0.21733399757004004
758,"Given the roots of two binary trees root and subRoot, return true if there is a subtree of root with the same structure and node values of subRoot and false otherwise.

A subtree of a binary tree tree is a tree that consists of a node in tree and all of this node's descendants. The tree tree could also be considered as a subtree of itself.",37172,root,return,6.725433722188183,6.319968614080018,343,66,5.196969696969697,41,0.024390243902439022,4.435477857152144,0.09986690233484356
762,"Given the root of an n-ary tree, return the preorder traversal of its nodes' values.

Nary-Tree input serialization is represented in their level order traversal. Each group of children is separated by the null value (See examples)",37337,root,return,6.725433722188183,6.319968614080018,233,37,6.297297297297297,32,0.03125,3.860559763845567,0.11100126405515301
544,Compute the square root of 4096.,25922,root,square,6.725433722188183,6.437751649736401,32,6,5.333333333333333,6,0.16666666666666666,3.5718165622936437,0.5953027603822739
426,Compute the square root of each number in the set.,19300,root,square,6.725433722188183,6.437751649736401,50,10,5.0,9,0.1111111111111111,3.4432228691373514,0.3505866435163976
340,Find root mean square (RMS) of the following numbers.,15415,root,square,6.725433722188183,6.437751649736401,53,9,5.888888888888889,9,0.1111111111111111,3.7378989678340577,0.41532210753711746
765,"Given the root of an n-ary tree, return the postorder traversal of its nodes' values.

Nary-Tree input serialization is represented in their level order traversal. Each group of children is separated by the null value.

Write the solution in C++.",37380,root,return,6.725433722188183,6.319968614080018,250,40,6.25,33,0.030303030303030304,3.8647632323151044,0.10488111503022726
309,Find the first five digits of the square root of 512.,13707,root,square,6.725433722188183,6.437751649736401,53,11,4.818181818181818,9,0.1111111111111111,4.128820976062352,0.38994581441151244
685,"Solve this competitive programming challenge using C++:

Given the root of a binary tree, return the sum of all left leaves.
A leaf is a node with no children. A left leaf is a leaf that is the left child of another node.",32971,root,return,6.725433722188183,6.319968614080018,224,43,5.209302325581396,30,0.03333333333333334,4.483973530381496,0.1290189969321906
728,"Given the root of a Binary Search Tree (BST), return the minimum absolute difference between the values of any two different nodes in the tree.",36221,root,return,6.725433722188183,6.319968614080018,143,25,5.72,21,0.04761904761904763,4.294432489139897,0.1771135417032565
260,"Given the root of a binary tree and an integer targetSum, return true if the tree has a root-to-leaf path such that adding up all the values along the path equals targetSum.

A leaf is a node with no children.",11440,root,return,6.725433722188183,6.319968614080018,211,40,5.275,33,0.030303030303030304,4.601071934109363,0.1315289756273847
288,Calculate the square root of 36. Output the number directly.,13116,root,square,6.725433722188183,6.437751649736401,60,10,6.0,9,0.1111111111111111,3.763095078805308,0.3850796071242581
169,"Given the root of a binary tree, return all root-to-leaf paths in any order.

A leaf is a node with no children.",6757,root,return,6.725433722188183,6.319968614080018,114,22,5.181818181818182,21,0.04761904761904761,3.9619610886649004,0.1824862589779977
718,"Write a solution in C++ for the following problem:

Given the root of a binary search tree (BST) with duplicates, return all the mode(s) (i.e., the most frequently occurred element) in it.

If the tree has more than one mode, return them in any order.

Assume a BST is defined as follows:

- The left subtree of a node contains only nodes with keys less than or equal to the node's key.
- The right subtree of a node contains only nodes with keys greater than or equal to the node's key.
- Both the left and right subtrees must also be binary search trees.",35524,root,return,6.725433722188183,6.319968614080018,566,105,5.390476190476191,66,0.015151515151515152,4.214628783594511,0.06225994492054935
257,"Given the root of a binary tree, return the inorder traversal of its nodes' values.",11396,root,return,6.725433722188183,6.319968614080018,83,15,5.533333333333333,13,0.07692307692307693,3.4877294678353654,0.24322083001997669
971,Explain how to obtain the square root of a number,51116,root,square,6.725433722188183,6.437751649736401,49,10,4.9,10,0.1,3.1058201146457876,0.31058201146457876
294,"Given the root of a binary tree, return its maximum depth. A binary tree's maximum depth is the number of nodes along the longest path from the root node down to the farthest leaf node.",13299,root,return,6.725433722188183,6.319968614080018,185,35,5.285714285714286,27,0.037037037037037035,4.775111334766479,0.16751443931109988
724,Obtain the square root of 64.,35976,root,square,6.725433722188183,6.437751649736401,29,6,4.833333333333333,6,0.16666666666666666,3.5718165622936437,0.5953027603822739
873,Generate a code in Python that calculates the square root of any given number.,44020,root,square,6.725433722188183,6.437751649736401,78,14,5.571428571428571,14,0.07142857142857141,2.748919395340491,0.19635138538146366
933,Find the root mean square (rms) of 10 and 15.,47851,root,square,6.725433722188183,6.437751649736401,45,10,4.5,10,0.1,3.8342925237616616,0.3834292523761662
779,"Write a solution for the following problem in python:

Given the root of a binary tree, return the average value of the nodes on each level in the form of an array. Answers within 10-5 of the actual answer will be accepted.",37678,root,return,6.725433722188183,6.319968614080018,225,42,5.357142857142857,32,0.03125,4.093144627265801,0.10358856532297572
26,"You are a smart assistant designed to help high school teachers come up with reading comprehension questions.
Given a piece of text, you must come up with a question and answer pair that can be used to test a student's reading comprehension abilities.
When coming up with this question/answer pair, you must respond in the following format:
```
{{
    ""question"": ""$YOUR_QUESTION_HERE"",
    ""answer"": ""$THE_ANSWER_HERE""
}}
```
Everything between the ``` must be valid json.
Please come up with a question/answer pair, in the specified JSON format, for the following text:
----------------
Previously, the use of dye-sub printing was limited to industrial or high-end commercial printing. Dye-sub photo printing has been used in medical imaging, graphic arts proofing, security, and broadcast-related applications. Today, it is extremely popular in event photography and photo booths or kiosks that require high-speed, on-demand printing.

Alps Electric produced the first quality dye-sub printers for home consumers in the $500–$1,000 price range, bringing dye-sublimation technology within the reach of a wider audience. (These models were, however, not true page printers, since they used a narrow printhead that swept across the page, like most inkjet printers.) Now there are many dye-sublimation printers on the market starting from as low as $100, especially postcard-sized mobile photo printers.

The ability to produce instant photo prints inexpensively from a small printer has led to dye sublimation solutions supplanting traditional instant photos in some applications, such as ID photography with a card printer.

Several corporations market desktop-size units as stand-alone printers and for print kiosk and photo booth applications. Some of these units are based on generic printers. Some manufacturers, offer software development kits with their printers, suggesting that these companies hope to attract system integrators as a potential market.

Desktop-size standalone dye-sub photo printers are also used by photographers in event photography. The technology allows photographers to produce and sell lab-quality prints immediately during the event they are attending, with a minimal amount of hardware.",134,some,by,4.933674252960127,3.892220378131966,2240,323,6.934984520123839,210,0.004761904761904762,5.140861555450791,0.024080468527741393
45,"You are a smart assistant designed to help high school teachers come up with reading comprehension questions.
Given a piece of text, you must come up with a question and answer pair that can be used to test a student's reading comprehension abilities.
When coming up with this question/answer pair, you must respond in the following format:
```
{{
    ""question"": ""$YOUR_QUESTION_HERE"",
    ""answer"": ""$THE_ANSWER_HERE""
}}
```
Everything between the ``` must be valid json.
""""""
templ2 = """"""Please come up with a question/answer pair, in the specified JSON format, for the following text:
----------------
Millions of lives could be saved by a groundbreaking set of new vaccines for a range of conditions including cancer, experts have said. A leading pharmaceutical firm said it is confident that jabs for cancer, cardiovascular and autoimmune diseases, and other conditions will be ready by 2030.

Studies into these vaccinations are also showing “tremendous promise”, with some researchers saying 15 years’ worth of progress has been “unspooled” in 12 to 18 months thanks to the success of the Covid jab.

Dr Paul Burton, the chief medical officer of pharmaceutical company Moderna, said he believes the firm will be able to offer such treatments for “all sorts of disease areas” in as little as five years.

The firm, which created a leading coronavirus vaccine, is developing cancer vaccines that target different tumor types.",713,some,by,4.933674252960127,3.892220378131966,1449,226,6.411504424778761,156,0.00641025641025641,5.086666765712668,0.03045466998791268
514,Name some problems that are solved by artificial intelligence algorithms.,24278,some,by,4.933674252960127,3.892220378131966,73,10,7.3,10,0.1,4.938306981916062,0.4938306981916063
21,"Use the following pieces of context to answer the question at the end. If you don't know the answer, just say that you don't know, don't try to make up an answer.

Previously, the use of dye-sub printing was limited to industrial or high-end commercial printing. Dye-sub photo printing has been used in medical imaging, graphic arts proofing, security, and broadcast-related applications. Today, it is extremely popular in event photography and photo booths or kiosks that require high-speed, on-demand printing.

Alps Electric produced the first quality dye-sub printers for home consumers in the $500–$1,000 price range, bringing dye-sublimation technology within the reach of a wider audience. (These models were, however, not true page printers, since they used a narrow printhead that swept across the page, like most inkjet printers.) Now there are many dye-sublimation printers on the market starting from as low as $100, especially postcard-sized mobile photo printers.

The ability to produce instant photo prints inexpensively from a small printer has led to dye sublimation solutions supplanting traditional instant photos in some applications, such as ID photography with a card printer.

Several corporations market desktop-size units as stand-alone printers and for print kiosk and photo booth applications. Some of these units are based on generic printers. Some manufacturers, offer software development kits with their printers, suggesting that these companies hope to attract system integrators as a potential market.

Desktop-size standalone dye-sub photo printers are also used by photographers in event photography. The technology allows photographers to produce and sell lab-quality prints immediately during the event they are attending, with a minimal amount of hardware. 

Question: Is the Epson F7100 a dye sub printer?",100,some,by,4.933674252960127,3.892220378131966,1857,274,6.7773722627737225,186,0.005376344086021506,5.112549813106629,0.02679843259008444
617,Paraphrase this sentence by reusing some of the words.,29875,some,by,4.933674252960127,3.892220378131966,54,9,6.0,9,0.1111111111111111,2.4465219883518667,0.2718357764835408
15,"Use the following pieces of context to answer the question at the end. If you don't know the answer, just say that you don't know, don't try to make up an answer.

Previously, the use of dye-sub printing was limited to industrial or high-end commercial printing. Dye-sub photo printing has been used in medical imaging, graphic arts proofing, security, and broadcast-related applications. Today, it is extremely popular in event photography and photo booths or kiosks that require high-speed, on-demand printing.

Alps Electric produced the first quality dye-sub printers for home consumers in the $500–$1,000 price range, bringing dye-sublimation technology within the reach of a wider audience. (These models were, however, not true page printers, since they used a narrow printhead that swept across the page, like most inkjet printers.) Now there are many dye-sublimation printers on the market starting from as low as $100, especially postcard-sized mobile photo printers.

The ability to produce instant photo prints inexpensively from a small printer has led to dye sublimation solutions supplanting traditional instant photos in some applications, such as ID photography with a card printer.

Several corporations market desktop-size units as stand-alone printers and for print kiosk and photo booth applications. Some of these units are based on generic printers. Some manufacturers, offer software development kits with their printers, suggesting that these companies hope to attract system integrators as a potential market.

Desktop-size standalone dye-sub photo printers are also used by photographers in event photography. The technology allows photographers to produce and sell lab-quality prints immediately during the event they are attending, with a minimal amount of hardware. 

Question: What are the uses of a dye sublimation printer?",92,some,by,4.933674252960127,3.892220378131966,1867,275,6.789090909090909,184,0.005434782608695652,5.112549813106629,0.026864048116490857
874,The polynomial x^101 + Ax + B is divisible by x^2 + x + 1 for some real numbers A and B. Find A + B.,44036,some,by,4.933674252960127,3.892220378131966,100,26,3.8461538461538463,20,0.05000000000000001,4.485953901809429,0.17253668853113188
625,List some diseases caused by smoking.,30286,some,by,4.933674252960127,3.892220378131966,37,6,6.166666666666667,6,0.16666666666666666,5.660351297264092,0.9433918828773487
596,"Goal:
Your vehicle is moving at speed v0 and has an acceleration of a. Find the speed v1 after x meters.

The formula to calculate the speed is:
v1 ^ 2 - v0 ^ 2 = 2 * a * x

The formula works only with the following units, you might have to do some conversion:
m/s for v1 and v0
m/s^2 for a
m for x

BE CAREFUL OF THE UNIT!

Input:
Line 1: v0, consisting of the original speed (integer) and the unit, separated by a space. The unit can be m/s or km/h
Line 2: An integer a, the acceleration, in meter per second squared
Line 3: An integer x, the distance, in meter

Output:
You must output a string with the speed v1 rounded to the nearest integer and the unit separated by a space, using the same unit as v0.",28941,some,by,4.933674252960127,3.892220378131966,727,145,5.0137931034482754,92,0.010869565217391304,4.256268645626318,0.042356726082287056
681,"Write a Java Function to solve this:

Given two strings s and t, return true if s is a subsequence of t, or false otherwise.

A subsequence of a string is a new string that is formed from the original string by deleting some (can be none) of the characters without disturbing the relative positions of the remaining characters. (i.e., ""ace"" is a subsequence of ""abcde"" while ""aec"" is not).",32963,some,by,4.933674252960127,3.892220378131966,393,70,5.614285714285714,49,0.02040816326530612,4.444410161243195,0.0877349105499331
720,"In this task, you will make changes to an existing sentence by replacing some of the words with synonyms and rearranging the words.",35580,some,by,4.933674252960127,3.892220378131966,131,23,5.695652173913044,22,0.04545454545454544,3.245181431352699,0.14215403557134043
420,"Given head, the head of a linked list, determine if the linked list has a cycle in it.

There is a cycle in a linked list if there is some node in the list that can be reached again by continuously following the next pointer. Internally, pos is used to denote the index of the node that tail's next pointer is connected to. Note that pos is not passed as a parameter.

Return true if there is a cycle in the linked list. Otherwise, return false.",19130,some,by,4.933674252960127,3.892220378131966,449,86,5.22093023255814,51,0.0196078431372549,3.676993301069895,0.07933321512807642
405,Name some methods by which to improve time management.,18492,some,by,4.933674252960127,3.892220378131966,54,9,6.0,9,0.1111111111111111,4.474261046085325,0.49714011623170273
221,Name some diseases caused by the lack of proper nutrition in humans.,9636,some,by,4.933674252960127,3.892220378131966,68,12,5.666666666666667,12,0.08333333333333333,4.399116341721934,0.36659302847682784
768,"We define a harmonious array as an array where the difference between its maximum value and its minimum value is exactly 1.

Given an integer array nums, return the length of its longest harmonious subsequence among all its possible subsequences.

A subsequence of array is a sequence that can be derived from the array by deleting some or no elements without changing the order of the remaining elements.",37442,some,by,4.933674252960127,3.892220378131966,409,68,6.014705882352941,49,0.02040816326530612,4.669532374103018,0.08901099480242206
836,"A single word for non-domesticated animals that live among humans?

Is there a specific, single-word adjective for animals that live among human beings but are not pets, livestock, or work animals? Examples would be insect pests living in a house, like cockroaches or ants; birds that live in the trees in a supermarket parking lot and feed off of human refuse; or rodents or deer that live near human settlements and feed off of plants cultivated by humans.

They are not quite wild, in the sense of living apart from humans in a ""natural"" state. Nor are they domesticated, in the sense of being tamed and put to specific purposes for the benefit of humans.

These animals could be described as opportunistic, and in some cases could be called commensal, but is there a more specific word than those?",41477,some,by,4.933674252960127,3.892220378131966,807,139,5.805755395683454,88,0.011363636363636364,4.821986616546066,0.05626470741847231
841,What are some of the challenges faced by electric cars and how can they be overcome?,41878,some,by,4.933674252960127,3.892220378131966,84,16,5.25,16,0.0625,4.266455905374982,0.26665349408593636
863,Identify some common mistakes made by novice writers.,43295,some,by,4.933674252960127,3.892220378131966,53,8,6.625,8,0.125,5.27690593160454,0.6596132414505675
652,"For some real number r, the polynomial 8x^3 - 4x^2 - 42x + 45 is divisible by (x - r)^2. Find r.",31428,some,by,4.933674252960127,3.892220378131966,96,22,4.363636363636363,20,0.04999999999999999,4.910447451047448,0.22320215686579312
818,"Given the following text, detect any spelling errors and correct them.",40180,spelling,errors,5.809142990314028,5.8781358618009785,70,11,6.363636363636363,11,0.09090909090909091,4.066423589652365,0.36967487178657865
907,Detect any spelling errors in this sentence and correct them.,46442,spelling,errors,5.809142990314028,5.8781358618009785,61,10,6.1,10,0.1,3.6354406447205716,0.36354406447205717
773,Find five spelling errors in the following text.,37534,spelling,errors,5.809142990314028,5.8781358618009785,48,8,6.0,8,0.125,2.9878470356717286,0.3734808794589661
464,Fix any grammar and spelling errors in the following sentence.,21363,spelling,errors,5.809142990314028,5.8781358618009785,62,10,6.2,10,0.1,3.3162063791240652,0.3316206379124066
538,Spot the spelling errors in a given sentence.,25598,spelling,errors,5.809142990314028,5.8781358618009785,45,8,5.625,8,0.125,2.591385024603921,0.3239231280754901
465,"Find errors in grammar, spelling and punctuation in the following sentence and correct them.",21365,spelling,errors,5.809142990314028,5.8781358618009785,92,14,6.571428571428571,12,0.08333333333333331,3.3497567896548675,0.25987817635206373
403,Take the following sentence and fix the spelling and grammar errors,18456,spelling,errors,5.809142990314028,5.8781358618009785,67,11,6.090909090909091,9,0.1111111111111111,3.868354058895194,0.3749179243536289
581,Check for spelling and grammar errors in the sentence,27711,spelling,errors,5.809142990314028,5.8781358618009785,53,9,5.888888888888889,9,0.1111111111111111,3.027881032101483,0.33643122578905366
122,"Given the input text, identify two potential grammar or spelling errors and provide their corrections.",4499,spelling,errors,5.809142990314028,5.8781358618009785,102,15,6.8,15,0.06666666666666667,3.7713755490149534,0.2514250366009969
597,Detect and correct all the spelling errors in this sentence.,29011,spelling,errors,5.809142990314028,5.8781358618009785,60,10,6.0,10,0.1,3.88494813631317,0.388494813631317
686,Remove the spelling errors in the following sentence,33044,spelling,errors,5.809142990314028,5.8781358618009785,52,8,6.5,7,0.14285714285714285,2.867738064613432,0.36760277812222825
966,Detect any spelling errors in the following word.,50768,spelling,errors,5.809142990314028,5.8781358618009785,49,8,6.125,8,0.125,3.2706489594455097,0.4088311199306887
