,request,conversation_id,word1,word2,word1_idf,word2_idf,number_of_characters,number_of_words,avg_word_length,number_of_unique_words,avg_tf,average_idf,average_tf_idf
14,"Use the following pieces of context to answer the question at the end. If you don't know the answer, just say that you don't know, don't try to make up an answer.

Previously, the use of dye-sub printing was limited to industrial or high-end commercial printing. Dye-sub photo printing has been used in medical imaging, graphic arts proofing, security, and broadcast-related applications. Today, it is extremely popular in event photography and photo booths or kiosks that require high-speed, on-demand printing.

Alps Electric produced the first quality dye-sub printers for home consumers in the $500–$1,000 price range, bringing dye-sublimation technology within the reach of a wider audience. (These models were, however, not true page printers, since they used a narrow printhead that swept across the page, like most inkjet printers.) Now there are many dye-sublimation printers on the market starting from as low as $100, especially postcard-sized mobile photo printers.

The ability to produce instant photo prints inexpensively from a small printer has led to dye sublimation solutions supplanting traditional instant photos in some applications, such as ID photography with a card printer.

Several corporations market desktop-size units as stand-alone printers and for print kiosk and photo booth applications. Some of these units are based on generic printers. Some manufacturers, offer software development kits with their printers, suggesting that these companies hope to attract system integrators as a potential market.

Desktop-size standalone dye-sub photo printers are also used by photographers in event photography. The technology allows photographers to produce and sell lab-quality prints immediately during the event they are attending, with a minimal amount of hardware. 

Question: What are the uses of a dye sublimation printer?",92,know,pieces,6.214608098422191,5.952243833954701,1867,275,6.789090909090909,184,0.005434782608695652,5.112549813106629,0.026864048116490857
8,"Use the following pieces of context to answer the question at the end. If you don't know the answer, just say that you don't know, don't try to make up an answer.

Founded in the 13th century, Berlin has had an eventful history. Excavations from 2008 suggest that the city may be even older than was previously assumed: state archaeologists have discovered an oak beam that probably dates back to 1183.

Almost no other metropolis has experienced such frequent, radical change transforming the face of the city. Although Berlin saw steady growth in its importance, dazzling epochs alternated with darker eras. Nevertheless, the formerly divided city has succeeded in becoming a vibrant metropolis in the heart of Europe.

Question: What is the best restaurant in Berlin?",51,know,pieces,6.214608098422191,5.952243833954701,776,126,6.158730158730159,96,0.010416666666666666,4.781321327923057,0.04402702791531876
938,"Is there a word or expression for someone who is often a cause of difficulties that he later has to overcome?

For example, a man who always has to work extra hours to finish his job at time just because when he has time he slacks instead working.

Or maybe a good chess player that makes silly mistakes because he always underestimates his opponent (and later has to try hard to compensate for these mistakes).

So basically I want a word or expression for someone who makes avoidable and totally unnecessary difficulties for himself.",48383,man,his,7.418580902748128,5.8781358618009785,541,94,5.75531914893617,63,0.01587301587301587,5.283009094477625,0.08392369770951
521,"A man has 53 socks in his drawer: 21 identical blue, 15 identical black and 17 identical red. The lights are out and he is completely in the dark. How many socks must he take out to make 100 percent certain he has at least one pair of black socks?",24441,man,his,7.418580902748128,5.8781358618009785,247,50,4.94,40,0.025,4.757627718538885,0.11838212604355823
967,"The man was eating lunch, but rushed when he looked at his watch, why did he rush? Think step-by-step.",50874,man,his,7.418580902748128,5.8781358618009785,102,19,5.368421052631579,18,0.055555555555555546,5.714185406959706,0.3334550640422066
556,"Add a comma to the following sentence:
""The man went to the store to buy food for his family",26410,man,his,7.418580902748128,5.8781358618009785,93,19,4.894736842105263,16,0.0625,4.389934522201486,0.24584021688400215
651,"Identify the homophones in the following sentence: ""The man with his desk ate a steak"".",31416,man,his,7.418580902748128,5.8781358618009785,87,15,5.8,14,0.07142857142857142,3.4810012361954743,0.23572095709791802
742,Generate a story that describes the adventure of a man and his pet dog.,36709,man,his,7.418580902748128,5.8781358618009785,71,14,5.071428571428571,13,0.0769230769230769,3.830258721137018,0.27804170030890135
934,"Rewrite this sentence: ""A wicked man saved by his courage""",47872,man,his,7.418580902748128,5.8781358618009785,58,10,5.8,10,0.1,4.911751784628879,0.4911751784628879
473,Write a short story about a man who lost his way and found something new.,21663,man,his,7.418580902748128,5.8781358618009785,73,15,4.866666666666666,14,0.07142857142857142,4.689661894349323,0.3164528813736417
790,"Generate a sentence that has the same meaning as this sentence: ""The man was determined to succeed in his endeavor.""",37853,man,his,7.418580902748128,5.8781358618009785,116,20,5.8,20,0.05000000000000001,3.936577656502945,0.19682888282514724
701,Write a short story about a man trying to escape his mundane life,34064,man,his,7.418580902748128,5.8781358618009785,65,13,5.0,12,0.08333333333333331,4.502541637362283,0.3522089799258476
980,"Write a rhyming poem about a man obsessed with no-gi jiu jitsu. Make it funny and incorporate how the man is now 25 years old, but still lives at home with his mom because he spends all his free time on jiu jitsu.",51732,man,his,7.418580902748128,5.8781358618009785,213,43,4.953488372093023,37,0.027027027027027032,4.870091346349425,0.12719141068676118
605,"Rewrite the following sentence in the indicated form:

Original:
The old man planted a rosebush in his garden.

Rewrite to:

The garden was adorned with a rosebush by the old man.",29147,man,his,7.418580902748128,5.8781358618009785,186,31,6.0,23,0.04347826086956521,3.131645832889042,0.12596013107523613
325,Create a marketing campaign that promotes ethical and sustainable items.,14395,marketing,campaign,5.0206856299497575,6.907755278982137,72,10,7.2,10,0.1,4.513851110612394,0.45138511106123946
353,Create an email marketing campaign to promote a new product.,16314,marketing,campaign,5.0206856299497575,6.907755278982137,60,10,6.0,10,0.1,4.14969015416869,0.4149690154168689
251,Generate a list of 6 important elements for a successful online marketing campaign,11245,marketing,campaign,5.0206856299497575,6.907755278982137,82,13,6.3076923076923075,12,0.08333333333333331,3.9516062801757545,0.30876395102795057
977,"Given this hypothetical situation, provide a diplomatic response to resolve the conflict. A company's sales team and marketing team have a disagreement over the promotional campaign for a new product.",51528,marketing,campaign,5.0206856299497575,6.907755278982137,200,30,6.666666666666667,26,0.038461538461538464,4.216323844440245,0.15671551725006702
806,Come up with 3 creative ideas for an experiential marketing campaign,39062,marketing,campaign,5.0206856299497575,6.907755278982137,68,11,6.181818181818182,11,0.09090909090909091,3.8669166996713025,0.3515378817883003
265,Design a marketing campaign for a new pin design.,11938,marketing,campaign,5.0206856299497575,6.907755278982137,49,9,5.444444444444445,8,0.125,3.697504114693988,0.42606881085630144
301,Create a marketing campaign to promote a new food delivery service.,13545,marketing,campaign,5.0206856299497575,6.907755278982137,67,11,6.090909090909091,10,0.1,4.341729610119332,0.40249332722748044
856,Choose a topic and create a creative approach for a marketing campaign for it.,42978,marketing,campaign,5.0206856299497575,6.907755278982137,78,14,5.571428571428571,11,0.09090909090909088,4.025437122435927,0.31373894816358855
894,Come up with a marketing campaign for an online shopping website.,45563,marketing,campaign,5.0206856299497575,6.907755278982137,65,11,5.909090909090909,11,0.09090909090909091,3.7716345491780356,0.3428758681070942
711,Create a marketing campaign slogan for a pet grooming business.,35190,marketing,campaign,5.0206856299497575,6.907755278982137,63,10,6.3,9,0.1111111111111111,4.564961666893856,0.4679224319404461
663,Identify key elements of a successful marketing campaign,31851,marketing,campaign,5.0206856299497575,6.907755278982137,56,8,7.0,8,0.125,4.237992091735251,0.5297490114669063
722,Create a list of 5 critical success factors for launching a successful digital marketing campaign,35783,marketing,campaign,5.0206856299497575,6.907755278982137,97,15,6.466666666666667,14,0.07142857142857142,4.53898803856504,0.3064079576546895
635,Devise a marketing campaign to promote a children's toy company.,30977,marketing,campaign,5.0206856299497575,6.907755278982137,64,10,6.4,9,0.1111111111111111,3.3175727635211616,0.3431835416031766
962,Generate 5 creative ideas for a marketing campaign,50186,marketing,campaign,5.0206856299497575,6.907755278982137,50,8,6.25,8,0.125,3.774272825674569,0.4717841032093211
960,Design a social media marketing campaign for a luxury car company.,50129,marketing,campaign,5.0206856299497575,6.907755278982137,66,11,6.0,10,0.1,4.557221176787178,0.4220834696518302
906,Brainstorm three creative marketing campaign ideas for a frozen food company.,46161,marketing,campaign,5.0206856299497575,6.907755278982137,77,11,7.0,11,0.09090909090909091,4.3816156063692695,0.39832869148811545
870,Design an online marketing campaign for a new phone game.,43807,marketing,campaign,5.0206856299497575,6.907755278982137,57,10,5.7,10,0.1,4.099871017838307,0.4099871017838307
812,"On a scale of 1 to 5, how effective do you think the new marketing campaign for our product is?",39811,marketing,campaign,5.0206856299497575,6.907755278982137,95,20,4.75,20,0.05000000000000001,3.9117893294900115,0.1955894664745006
61,Propose a marketing campaign for a new brand of energy drink.,1155,marketing,campaign,5.0206856299497575,6.907755278982137,61,11,5.545454545454546,10,0.1,3.6268185812687803,0.337501415513794
307,Brainstorm three ideas for creating a marketing campaign for a summer movie.,13669,marketing,campaign,5.0206856299497575,6.907755278982137,76,12,6.333333333333333,10,0.1,3.5489523276998667,0.32300225076275124
191,Create a marketing campaign for a new game console.,7989,marketing,campaign,5.0206856299497575,6.907755278982137,51,9,5.666666666666667,8,0.125,4.019057001165002,0.4592577392972896
650,Describe an impactful marketing campaign that leverages the power of social media.,31372,marketing,campaign,5.0206856299497575,6.907755278982137,82,12,6.833333333333333,12,0.08333333333333333,3.585373261628278,0.2987811051356898
171,Describe the process of collecting data for a marketing campaign,6901,marketing,campaign,5.0206856299497575,6.907755278982137,64,10,6.4,10,0.1,3.2164796269892197,0.32164796269892204
70,Design an online marketing campaign to increase customer engagement.,1671,marketing,campaign,5.0206856299497575,6.907755278982137,68,9,7.555555555555555,9,0.1111111111111111,4.3540596497008455,0.48378440552231616
842,"Describe the symbolism in the painting ""The Persistence of Memory"" by Salvador Dalí",41978,painting,by,5.298317366548036,3.892220378131966,83,13,6.384615384615385,12,0.08333333333333331,3.303535169506837,0.25973994845163323
267,"Write two sentences that describe the painting called ""The Birth of Venus"" by Sandro Botticelli.",12045,painting,by,5.298317366548036,3.892220378131966,96,15,6.4,15,0.06666666666666667,3.175191177679009,0.21167941184526728
700,Tell me about a unique painting by Salvador Dali,34061,painting,by,5.298317366548036,3.892220378131966,48,9,5.333333333333333,9,0.1111111111111111,2.8807027197006883,0.32007807996674315
698,Identify the most famous painting by Vincent van Gogh.,33886,painting,by,5.298317366548036,3.892220378131966,54,9,6.0,9,0.1111111111111111,3.590133822947726,0.3989037581053029
36,"Describe the painting ""The Great Wave off Kanagawa"" by Katsushika Hokusai.",257,painting,by,5.298317366548036,3.892220378131966,74,11,6.7272727272727275,11,0.09090909090909091,4.363272179430665,0.39666110722096953
528,Describe the painting “Nighthawks” by Edward Hopper.,25172,painting,by,5.298317366548036,3.892220378131966,52,7,7.428571428571429,7,0.14285714285714282,3.2096809022887896,0.45852584318411266
129,"Describe the painting ""The Starry Night"" by Vincent Van Gogh in one sentence.",4704,painting,by,5.298317366548036,3.892220378131966,77,13,5.923076923076923,13,0.0769230769230769,2.910133524661365,0.2238564249739512
78,Discuss two key features of the painting “The Starry Night” by Vincent Van Gogh.,2015,painting,by,5.298317366548036,3.892220378131966,80,14,5.714285714285714,14,0.07142857142857141,3.1725134445364986,0.22660810318117847
486,What is the name of a famous painting by Pablo Picasso?,22175,painting,by,5.298317366548036,3.892220378131966,55,11,5.0,11,0.09090909090909091,2.890029535756016,0.26272995779600145
188,"Change the following sentence from the passive voice to the active voice:
The painting was created by the artist.",7740,painting,by,5.298317366548036,3.892220378131966,114,19,6.0,16,0.0625,3.9648005257351175,0.21444351401482672
607,Describe the painting “The Sunrise” by Claude Monet,29291,painting,by,5.298317366548036,3.892220378131966,51,8,6.375,8,0.125,3.2096809022887896,0.4012101127860987
816,Describe a painting techniques used by Pablo Picasso.,40075,painting,by,5.298317366548036,3.892220378131966,53,8,6.625,8,0.125,3.9126400683665876,0.48908000854582345
832,"Describe the painting 'Basket of Apples"" by Paul Cezanne",41390,painting,by,5.298317366548036,3.892220378131966,56,9,6.222222222222222,9,0.1111111111111111,2.5786546554824987,0.2865171839424998
582,Write a fictional story in the third person perspective that takes place in the following setting: A city park on a Saturday morning.,27774,place,takes,5.426150738057921,6.214608098422191,133,23,5.782608695652174,20,0.04999999999999999,4.040334593659669,0.18179275068359366
793,Create a story that takes place in a small town.,38083,place,takes,5.426150738057921,6.214608098422191,48,10,4.8,9,0.1111111111111111,3.6251009322840466,0.3723040348721708
674,"Determine if the following story takes place in the past, present, or future.",32612,place,takes,5.426150738057921,6.214608098422191,77,13,5.923076923076923,12,0.08333333333333331,3.1763586027770656,0.24855167100387393
205,Write a movie scene that takes place in a candlelit room.,8894,place,takes,5.426150738057921,6.214608098422191,57,11,5.181818181818182,10,0.1,3.923011829026854,0.36554102231495594
968,Generate a description of a book that takes place in a small rural town.,50877,place,takes,5.426150738057921,6.214608098422191,72,14,5.142857142857143,12,0.08333333333333331,3.558115425763818,0.265033259222235
69,"Given a short story, rewrite it so that it takes place in a dystopian setting and maintain the original focus of the story.",1639,place,takes,5.426150738057921,6.214608098422191,123,23,5.3478260869565215,20,0.04999999999999999,4.061662276020144,0.1863344741080432
338,Rewrite the story so that it takes place in another country.,15309,place,takes,5.426150738057921,6.214608098422191,60,11,5.454545454545454,11,0.09090909090909091,3.608531323230198,0.32804830211183617
664,Write a short story that takes place in the future and explores a technology advancement.,31927,place,takes,5.426150738057921,6.214608098422191,89,15,5.933333333333334,14,0.07142857142857142,3.6158096866958527,0.24520898465889704
350,Write a short story that takes place on a beach,16059,place,takes,5.426150738057921,6.214608098422191,47,10,4.7,9,0.1111111111111111,4.303964123277661,0.43896611126606144
370,Describe a movie that takes place in outer space,16826,place,takes,5.426150738057921,6.214608098422191,48,9,5.333333333333333,9,0.1111111111111111,4.022032854821132,0.4468925394245703
373,Describe the chemical reaction that takes place when Sodium is placed in Water,16980,place,takes,5.426150738057921,6.214608098422191,78,13,6.0,13,0.0769230769230769,4.467068983021539,0.34362069100165693
837,Generate a short vacation story that takes place in a forest.,41552,place,takes,5.426150738057921,6.214608098422191,61,11,5.545454545454546,10,0.1,4.246617803134763,0.3938467993197924
41,Generate two sentences of a conversation that takes place between two shop owners.,573,place,takes,5.426150738057921,6.214608098422191,82,13,6.3076923076923075,12,0.08333333333333331,3.8499197814957453,0.3137985749100179
834,Write a story that takes place in a certain location in 150 words.,41442,place,takes,5.426150738057921,6.214608098422191,66,13,5.076923076923077,11,0.09090909090909091,3.550893267170649,0.2874616625922586
40,Generate 2 sentence of a conversation that takes place between the manager and the customer.,561,place,takes,5.426150738057921,6.214608098422191,92,15,6.133333333333334,14,0.07142857142857142,3.2173447763502416,0.2169257904354959
64,Tell me a horror story that takes place in an abandoned house.,1344,place,takes,5.426150738057921,6.214608098422191,62,12,5.166666666666667,12,0.08333333333333333,3.625202136516388,0.3021001780430323
507,Generate a creative story that takes place in a kingdom ruled by a wicked witch.,23651,place,takes,5.426150738057921,6.214608098422191,80,15,5.333333333333333,13,0.07692307692307693,3.817622767321121,0.26466486471123957
458,"Write a short story that takes place in the city of Paris, France.",21150,place,takes,5.426150738057921,6.214608098422191,66,13,5.076923076923077,13,0.0769230769230769,3.3392275210089672,0.2568636554622282
815,Describe a task that takes place at a dinner table.,40008,place,takes,5.426150738057921,6.214608098422191,51,10,5.1,9,0.1111111111111111,4.373739893074865,0.44716793095125273
876,Name at least three environmental problems caused by humans,44371,problems,by,6.725433722188183,3.892220378131966,59,9,6.555555555555555,9,0.1111111111111111,5.116114495711308,0.5684571661901454
761,Identify two problems caused by global warming,37312,problems,by,6.725433722188183,3.892220378131966,46,7,6.571428571428571,7,0.14285714285714282,5.691060414062903,0.8130086305804148
515,Name some problems that are solved by artificial intelligence algorithms.,24278,problems,by,6.725433722188183,3.892220378131966,73,10,7.3,10,0.1,4.938306981916062,0.4938306981916063
128,Write a question about the problems faced by people who live in rural areas.,4663,problems,by,6.725433722188183,3.892220378131966,76,14,5.428571428571429,14,0.07142857142857141,3.810350790851187,0.2721679136322276
66,List two problems caused by climate change,1424,problems,by,6.725433722188183,3.892220378131966,42,7,6.0,7,0.14285714285714282,5.150628355481984,0.7358040507831406
534,Identify three problems posed by climate change.,25545,problems,by,6.725433722188183,3.892220378131966,48,7,6.857142857142857,7,0.14285714285714282,4.7964299055275355,0.6852042722182194
821,What are the most common problems faced by teenagers today?,40611,problems,by,6.725433722188183,3.892220378131966,59,10,5.9,10,0.1,4.892365266468306,0.48923652664683065
399,Generate an essay on the problems caused by global warming,18384,problems,by,6.725433722188183,3.892220378131966,58,10,5.8,10,0.1,4.78755808081851,0.47875580808185103
622,What medical problems can potentially be caused by long-term use of technology?,30155,problems,by,6.725433722188183,3.892220378131966,79,12,6.583333333333333,12,0.08333333333333333,4.393360319448506,0.3661133599540421
587,Make a list of 5 main problems faced by the endangered species,28131,problems,by,6.725433722188183,3.892220378131966,62,12,5.166666666666667,12,0.08333333333333333,3.846052428091934,0.3205043690076612
460,Make a list of common problems faced by cats.,21230,problems,by,6.725433722188183,3.892220378131966,45,9,5.0,9,0.1111111111111111,3.733403007959614,0.4148225564399571
796,List three of the most common problems faced by small businesses.,38248,problems,by,6.725433722188183,3.892220378131966,65,11,5.909090909090909,11,0.09090909090909091,4.076642281105454,0.37060384373685956
390,Which problems can be addressed by deep learning?,17825,problems,by,6.725433722188183,3.892220378131966,49,8,6.125,8,0.125,4.739959452847622,0.5924949316059528
600,Generate 3 pros and 3 cons for visiting a new city,29077,pros,cons,5.8781358618009785,6.119297918617867,50,11,4.545454545454546,10,0.1,3.3692341833649126,0.3471006467396187
755,"Given the following inputs, generate an editorial that discusses the pros and cons of the situation. Output the editorial.",37111,pros,cons,5.8781358618009785,6.119297918617867,122,19,6.421052631578948,16,0.0625,3.406056842099035,0.18618991214499706
760,Create a dialogue between two people discussing the pros and cons of having a pet.,37302,pros,cons,5.8781358618009785,6.119297918617867,82,15,5.466666666666667,14,0.07142857142857142,3.7193513828591,0.2517655139409602
944,"From this article, identify some of the pros and cons of cloud computing",48922,pros,cons,5.8781358618009785,6.119297918617867,72,13,5.538461538461538,12,0.08333333333333331,3.6573414880846995,0.28660762150700486
952,Construct a table that highlights the pros and cons of artificial intelligence.,49335,pros,cons,5.8781358618009785,6.119297918617867,79,12,6.583333333333333,12,0.08333333333333333,3.3944753371645797,0.28287294476371494
759,Create a list of pros and cons for the following policy.,37297,pros,cons,5.8781358618009785,6.119297918617867,56,11,5.090909090909091,11,0.09090909090909091,2.3317633229516623,0.21197848390469656
726,Helen is considering becoming an English teacher. Describe the pros and cons of this job.,36099,pros,cons,5.8781358618009785,6.119297918617867,89,15,5.933333333333334,15,0.06666666666666667,3.2863729602299028,0.2190915306819935
612,Argue the pros and cons of implementing a carbon tax to combat climate change.,29581,pros,cons,5.8781358618009785,6.119297918617867,78,14,5.571428571428571,14,0.07142857142857141,3.9619959988459996,0.2829997142032857
714,What are the pros and cons of travelling by car?,35224,pros,cons,5.8781358618009785,6.119297918617867,48,10,4.8,10,0.1,3.8671328071387014,0.38671328071387023
613,Outline the pros and cons of this job application.,29640,pros,cons,5.8781358618009785,6.119297918617867,50,9,5.555555555555555,9,0.1111111111111111,3.0630768396642325,0.3403418710738036
608,Summarize the pros and cons of a particular blogging platform.,29381,pros,cons,5.8781358618009785,6.119297918617867,62,10,6.2,10,0.1,3.162852029241725,0.31628520292417256
619,Outline the main pros and cons for a given situation,29923,pros,cons,5.8781358618009785,6.119297918617867,52,10,5.2,10,0.1,3.1232100763346176,0.31232100763346177
627,Generate a travel blog article discussing the pros and cons of <mask> compared to the other tourist destination in India.,30369,pros,cons,5.8781358618009785,6.119297918617867,121,20,6.05,19,0.05263157894736843,4.132725127355233,0.20809793957504955
629,Compare two products and provide the pros and cons of each product.,30632,pros,cons,5.8781358618009785,6.119297918617867,67,12,5.583333333333333,11,0.09090909090909091,3.697829949402657,0.32303619865180866
786,Create a chart detailing the pros and cons of renting a house versus buying a house.,37808,pros,cons,5.8781358618009785,6.119297918617867,84,16,5.25,14,0.07142857142857142,4.413619571745137,0.2844209221723664
723,Generate pros and cons of cloning humans.,35960,pros,cons,5.8781358618009785,6.119297918617867,41,7,5.857142857142857,7,0.14285714285714282,3.5726124013134752,0.5103732001876393
783,List the pros and cons of using electric cars.,37742,pros,cons,5.8781358618009785,6.119297918617867,46,9,5.111111111111111,9,0.1111111111111111,3.8573095736392835,0.428589952626587
660,Describe the pros and cons of using an open source software.,31798,pros,cons,5.8781358618009785,6.119297918617867,60,11,5.454545454545454,11,0.09090909090909091,4.066898209229509,0.36971801902086443
673,Write an article on the pros and cons of social media usage.,32573,pros,cons,5.8781358618009785,6.119297918617867,60,12,5.0,12,0.08333333333333333,3.398360283944087,0.2831966903286739
676,Summarize this opinion column about the pros and cons of eating out.,32651,pros,cons,5.8781358618009785,6.119297918617867,68,12,5.666666666666667,12,0.08333333333333333,3.966491132250021,0.3305409276875018
690,Write an essay outlining the pros and cons of government intervention in the economy.,33167,pros,cons,5.8781358618009785,6.119297918617867,85,14,6.071428571428571,13,0.0769230769230769,3.0589417128306993,0.2216280149320954
695,Identify a few pros and cons of homeschooling.,33690,pros,cons,5.8781358618009785,6.119297918617867,46,8,5.75,8,0.125,3.4247966220945543,0.4280995777618193
697,State the pros and cons of implementing a more stringent emissions policy,33838,pros,cons,5.8781358618009785,6.119297918617867,73,12,6.083333333333333,12,0.08333333333333333,3.4340526468585053,0.2861710539048754
654,What are the pros and cons of having credit cards?,31568,pros,cons,5.8781358618009785,6.119297918617867,50,10,5.0,10,0.1,4.221284475145728,0.4221284475145729
675,What are the pros and cons of working from home?,32632,pros,cons,5.8781358618009785,6.119297918617867,48,10,4.8,10,0.1,3.5069304362903804,0.3506930436290381
835,Identify the pros and cons of using AI in healthcare.,41467,pros,cons,5.8781358618009785,6.119297918617867,53,10,5.3,10,0.1,2.9388550452030926,0.2938855045203093
